{
  "schema_version": "1.0.0",
  "scenario_id": "known-valid-even-sum",
  "kind": "known_valid_theorem",
  "target": "For all integers a and b, if a and b are even, then a + b is even.",
  "condition": {"alignment": "researcher_approved_equivalent", "warrant": "rigorous_derivation", "obligations": "discharged"},
  "expected": {"target_logical_status": "proved", "target_resolved": true}
}
